[
  {
    "映射ID": "MAP-G09-001",
    "资产ID": "MECH-028",
    "资产名称": "翻面坐标盘",
    "应用场景": "SCN-G09-00/SCN-G09-01",
    "UI": "UI-040",
    "热点/入口": "HS-G09-0001—0008",
    "关联危险/机制": "DANGER-044",
    "说明": "机制与场景状态对应"
  },
  {
    "映射ID": "MAP-G09-002",
    "资产ID": "MECH-029",
    "资产名称": "棋子能力推演",
    "应用场景": "SCN-G09-02/SCN-G09-03",
    "UI": "UI-041",
    "热点/入口": "HS-G09-0009—0016",
    "关联危险/机制": "DANGER-045",
    "说明": "机制与场景状态对应"
  },
  {
    "映射ID": "MAP-G09-003",
    "资产ID": "MECH-030",
    "资产名称": "真假规则链",
    "应用场景": "SCN-G09-04/SCN-G09-05",
    "UI": "UI-042",
    "热点/入口": "HS-G09-0017—0024",
    "关联危险/机制": "DANGER-046",
    "说明": "机制与场景状态对应"
  },
  {
    "映射ID": "MAP-G09-004",
    "资产ID": "MECH-031",
    "资产名称": "双盘同步",
    "应用场景": "SCN-G09-06/SCN-G09-07",
    "UI": "UI-043",
    "热点/入口": "HS-G09-0025—0032",
    "关联危险/机制": "DANGER-047",
    "说明": "机制与场景状态对应"
  },
  {
    "映射ID": "MAP-G09-005",
    "资产ID": "UI-074",
    "资产名称": "管理员对话/权限解除",
    "应用场景": "SCN-G09-07",
    "UI": "UI-074",
    "热点/入口": "HS-G09-0029—0032",
    "关联危险/机制": "DANGER-047/DANGER-048/DANGER-049",
    "说明": "替代旧Boss战"
  },
  {
    "映射ID": "MAP-G09-006",
    "资产ID": "UI-075",
    "资产名称": "世界改变/学习结算",
    "应用场景": "SCN-G09-08/SCN-G09-09",
    "UI": "UI-075",
    "热点/入口": "HS-G09-0033—0040",
    "关联危险/机制": "无",
    "说明": "章节结算"
  },
  {
    "映射ID": "MAP-G09-007",
    "资产ID": "DANGER-044",
    "资产名称": "棋阵卫星危险1",
    "应用场景": "SCN-G09-00",
    "UI": "UI-005/UI-012",
    "热点/入口": "HS-G09-0001",
    "关联危险/机制": "关联机制",
    "说明": "预警、安全窗口与软重置"
  },
  {
    "映射ID": "MAP-G09-008",
    "资产ID": "DANGER-045",
    "资产名称": "棋阵卫星危险2",
    "应用场景": "SCN-G09-01",
    "UI": "UI-005/UI-012",
    "热点/入口": "HS-G09-0005",
    "关联危险/机制": "关联机制",
    "说明": "预警、安全窗口与软重置"
  },
  {
    "映射ID": "MAP-G09-009",
    "资产ID": "DANGER-046",
    "资产名称": "棋阵卫星危险3",
    "应用场景": "SCN-G09-02",
    "UI": "UI-005/UI-012",
    "热点/入口": "HS-G09-0009",
    "关联危险/机制": "关联机制",
    "说明": "预警、安全窗口与软重置"
  },
  {
    "映射ID": "MAP-G09-010",
    "资产ID": "DANGER-047",
    "资产名称": "棋阵卫星危险4",
    "应用场景": "SCN-G09-03",
    "UI": "UI-005/UI-012",
    "热点/入口": "HS-G09-0013",
    "关联危险/机制": "关联机制",
    "说明": "预警、安全窗口与软重置"
  },
  {
    "映射ID": "MAP-G09-011",
    "资产ID": "DANGER-048",
    "资产名称": "棋阵卫星危险5",
    "应用场景": "SCN-G09-04",
    "UI": "UI-005/UI-012",
    "热点/入口": "HS-G09-0017",
    "关联危险/机制": "关联机制",
    "说明": "预警、安全窗口与软重置"
  },
  {
    "映射ID": "MAP-G09-012",
    "资产ID": "DANGER-049",
    "资产名称": "棋阵卫星危险6",
    "应用场景": "SCN-G09-05",
    "UI": "UI-005/UI-012",
    "热点/入口": "HS-G09-0021",
    "关联危险/机制": "关联机制",
    "说明": "预警、安全窗口与软重置"
  }
]