[
  {
    "映射ID": "MAP-G02-001",
    "资产ID": "MECH-001",
    "资产名称": "资源网络",
    "应用场景": "SCN-G02-06",
    "UI": "UI-013",
    "热点/入口": "HS-G02-0036",
    "关联危险/机制": "DANGER-005",
    "说明": "五塔供能与过载保护"
  },
  {
    "映射ID": "MAP-G02-002",
    "资产ID": "MECH-002",
    "资产名称": "参数诊断",
    "应用场景": "SCN-G02-02/04",
    "UI": "UI-014",
    "热点/入口": "电视墙读数/极性切换器",
    "关联危险/机制": "DANGER-003/004",
    "说明": "读数诊断与磁芯极性"
  },
  {
    "映射ID": "MAP-G02-003",
    "资产ID": "MECH-003",
    "资产名称": "路径调度",
    "应用场景": "SCN-G02-03D/06",
    "UI": "UI-015",
    "热点/入口": "导线节点/五塔轮换",
    "关联危险/机制": "DANGER-001",
    "说明": "线路路径与供能轮换"
  },
  {
    "映射ID": "MAP-G02-004",
    "资产ID": "DANGER-001",
    "资产名称": "裸露电缆放电",
    "应用场景": "SCN-G02-03D/06",
    "UI": "UI-005",
    "热点/入口": "漏电池塘/五塔外环",
    "关联危险/机制": "无",
    "说明": "周期放电与安全节点"
  },
  {
    "映射ID": "MAP-G02-005",
    "资产ID": "DANGER-002",
    "资产名称": "吊臂落物区",
    "应用场景": "SCN-G02-01/03A",
    "UI": "UI-005",
    "热点/入口": "屏幕谷/发动机坑",
    "关联危险/机制": "无",
    "说明": "落物节奏预警"
  },
  {
    "映射ID": "MAP-G02-006",
    "资产ID": "DANGER-003",
    "资产名称": "电池洞穴过热",
    "应用场景": "SCN-G02-03A/03B",
    "UI": "UI-012",
    "热点/入口": "发动机/洞穴冷却",
    "关联危险/机制": "无",
    "说明": "温度累积与安全回退"
  },
  {
    "映射ID": "MAP-G02-007",
    "资产ID": "DANGER-004",
    "资产名称": "磁性碎片风",
    "应用场景": "SCN-G02-00/04",
    "UI": "UI-005",
    "热点/入口": "废料坡/磁力测试",
    "关联危险/机制": "无",
    "说明": "方向性环境危险"
  },
  {
    "映射ID": "MAP-G02-008",
    "资产ID": "DANGER-005",
    "资产名称": "能源塔过载",
    "应用场景": "SCN-G02-06",
    "UI": "UI-013/UI-012",
    "热点/入口": "五塔供能面板",
    "关联危险/机制": "MECH-001",
    "说明": "系统级软重置"
  },
  {
    "映射ID": "MAP-G02-009",
    "资产ID": "DANGER-006",
    "资产名称": "低温供暖中断",
    "应用场景": "SCN-G02-03C/06",
    "UI": "UI-005/UI-012",
    "热点/入口": "居民棚/稳定阶段",
    "关联危险/机制": "无",
    "说明": "温度安全线"
  },
  {
    "映射ID": "MAP-G02-010",
    "资产ID": "UI-060",
    "资产名称": "管理员对话/权限解除",
    "应用场景": "SCN-G02-06",
    "UI": "UI-060",
    "热点/入口": "五项权限节点",
    "关联危险/机制": "MECH-001/003",
    "说明": "替代旧Boss界面"
  },
  {
    "映射ID": "MAP-G02-011",
    "资产ID": "UI-061",
    "资产名称": "世界改变/学习结算",
    "应用场景": "SCN-G02-07",
    "UI": "UI-061",
    "热点/入口": "前后场景与归还状态",
    "关联危险/机制": "无",
    "说明": "章节结算"
  }
]