[
  {
    "映射ID": "MAP-G11-001",
    "资产ID": "MECH-036",
    "资产名称": "三视图装配",
    "应用场景": "SCN-G11-00/SCN-G11-01",
    "UI": "UI-048",
    "热点/入口": "HS-G11-0001—0008",
    "关联危险/机制": "DANGER-056",
    "说明": "机制与场景状态对应"
  },
  {
    "映射ID": "MAP-G11-002",
    "资产ID": "MECH-037",
    "资产名称": "空间装箱线",
    "应用场景": "SCN-G11-02/SCN-G11-03",
    "UI": "UI-049",
    "热点/入口": "HS-G11-0009—0016",
    "关联危险/机制": "DANGER-057",
    "说明": "机制与场景状态对应"
  },
  {
    "映射ID": "MAP-G11-003",
    "资产ID": "MECH-038",
    "资产名称": "受力分散阵",
    "应用场景": "SCN-G11-04/SCN-G11-05",
    "UI": "UI-050",
    "热点/入口": "HS-G11-0017—0024",
    "关联危险/机制": "DANGER-058",
    "说明": "机制与场景状态对应"
  },
  {
    "映射ID": "MAP-G11-004",
    "资产ID": "MECH-039",
    "资产名称": "关节避障序列",
    "应用场景": "SCN-G11-06/SCN-G11-07",
    "UI": "UI-051",
    "热点/入口": "HS-G11-0025—0032",
    "关联危险/机制": "DANGER-059",
    "说明": "机制与场景状态对应"
  },
  {
    "映射ID": "MAP-G11-005",
    "资产ID": "UI-078",
    "资产名称": "管理员对话/权限解除",
    "应用场景": "SCN-G11-07",
    "UI": "UI-078",
    "热点/入口": "HS-G11-0029—0032",
    "关联危险/机制": "DANGER-059/DANGER-060/DANGER-061",
    "说明": "替代旧Boss战"
  },
  {
    "映射ID": "MAP-G11-006",
    "资产ID": "UI-079",
    "资产名称": "世界改变/学习结算",
    "应用场景": "SCN-G11-08/SCN-G11-09",
    "UI": "UI-079",
    "热点/入口": "HS-G11-0033—0040",
    "关联危险/机制": "无",
    "说明": "章节结算"
  },
  {
    "映射ID": "MAP-G11-007",
    "资产ID": "DANGER-056",
    "资产名称": "立体工厂危险1",
    "应用场景": "SCN-G11-00",
    "UI": "UI-005/UI-012",
    "热点/入口": "HS-G11-0001",
    "关联危险/机制": "关联机制",
    "说明": "预警、安全窗口与软重置"
  },
  {
    "映射ID": "MAP-G11-008",
    "资产ID": "DANGER-057",
    "资产名称": "立体工厂危险2",
    "应用场景": "SCN-G11-01",
    "UI": "UI-005/UI-012",
    "热点/入口": "HS-G11-0005",
    "关联危险/机制": "关联机制",
    "说明": "预警、安全窗口与软重置"
  },
  {
    "映射ID": "MAP-G11-009",
    "资产ID": "DANGER-058",
    "资产名称": "立体工厂危险3",
    "应用场景": "SCN-G11-02",
    "UI": "UI-005/UI-012",
    "热点/入口": "HS-G11-0009",
    "关联危险/机制": "关联机制",
    "说明": "预警、安全窗口与软重置"
  },
  {
    "映射ID": "MAP-G11-010",
    "资产ID": "DANGER-059",
    "资产名称": "立体工厂危险4",
    "应用场景": "SCN-G11-03",
    "UI": "UI-005/UI-012",
    "热点/入口": "HS-G11-0013",
    "关联危险/机制": "关联机制",
    "说明": "预警、安全窗口与软重置"
  },
  {
    "映射ID": "MAP-G11-011",
    "资产ID": "DANGER-060",
    "资产名称": "立体工厂危险5",
    "应用场景": "SCN-G11-04",
    "UI": "UI-005/UI-012",
    "热点/入口": "HS-G11-0017",
    "关联危险/机制": "关联机制",
    "说明": "预警、安全窗口与软重置"
  },
  {
    "映射ID": "MAP-G11-012",
    "资产ID": "DANGER-061",
    "资产名称": "立体工厂危险6",
    "应用场景": "SCN-G11-05",
    "UI": "UI-005/UI-012",
    "热点/入口": "HS-G11-0021",
    "关联危险/机制": "关联机制",
    "说明": "预警、安全窗口与软重置"
  }
]