[
  {
    "映射ID": "MAP-G08-001",
    "资产ID": "MECH-024",
    "资产名称": "三钟同步",
    "应用场景": "SCN-G08-00/SCN-G08-01",
    "UI": "UI-036",
    "热点/入口": "HS-G08-0001—0008",
    "关联危险/机制": "DANGER-038",
    "说明": "机制与场景状态对应"
  },
  {
    "映射ID": "MAP-G08-002",
    "资产ID": "MECH-025",
    "资产名称": "窗口行动链",
    "应用场景": "SCN-G08-02/SCN-G08-03",
    "UI": "UI-037",
    "热点/入口": "HS-G08-0009—0016",
    "关联危险/机制": "DANGER-039",
    "说明": "机制与场景状态对应"
  },
  {
    "映射ID": "MAP-G08-003",
    "资产ID": "MECH-026",
    "资产名称": "循环日志保留",
    "应用场景": "SCN-G08-04/SCN-G08-05",
    "UI": "UI-038",
    "热点/入口": "HS-G08-0017—0024",
    "关联危险/机制": "DANGER-040",
    "说明": "机制与场景状态对应"
  },
  {
    "映射ID": "MAP-G08-004",
    "资产ID": "MECH-027",
    "资产名称": "相位门阵",
    "应用场景": "SCN-G08-06/SCN-G08-07",
    "UI": "UI-039",
    "热点/入口": "HS-G08-0025—0032",
    "关联危险/机制": "DANGER-041",
    "说明": "机制与场景状态对应"
  },
  {
    "映射ID": "MAP-G08-005",
    "资产ID": "UI-072",
    "资产名称": "管理员对话/权限解除",
    "应用场景": "SCN-G08-07",
    "UI": "UI-072",
    "热点/入口": "HS-G08-0029—0032",
    "关联危险/机制": "DANGER-041/DANGER-042/DANGER-043",
    "说明": "替代旧Boss战"
  },
  {
    "映射ID": "MAP-G08-006",
    "资产ID": "UI-073",
    "资产名称": "世界改变/学习结算",
    "应用场景": "SCN-G08-08/SCN-G08-09",
    "UI": "UI-073",
    "热点/入口": "HS-G08-0033—0040",
    "关联危险/机制": "无",
    "说明": "章节结算"
  },
  {
    "映射ID": "MAP-G08-007",
    "资产ID": "DANGER-038",
    "资产名称": "钟摆之城危险1",
    "应用场景": "SCN-G08-00",
    "UI": "UI-005/UI-012",
    "热点/入口": "HS-G08-0001",
    "关联危险/机制": "关联机制",
    "说明": "预警、安全窗口与软重置"
  },
  {
    "映射ID": "MAP-G08-008",
    "资产ID": "DANGER-039",
    "资产名称": "钟摆之城危险2",
    "应用场景": "SCN-G08-01",
    "UI": "UI-005/UI-012",
    "热点/入口": "HS-G08-0005",
    "关联危险/机制": "关联机制",
    "说明": "预警、安全窗口与软重置"
  },
  {
    "映射ID": "MAP-G08-009",
    "资产ID": "DANGER-040",
    "资产名称": "钟摆之城危险3",
    "应用场景": "SCN-G08-02",
    "UI": "UI-005/UI-012",
    "热点/入口": "HS-G08-0009",
    "关联危险/机制": "关联机制",
    "说明": "预警、安全窗口与软重置"
  },
  {
    "映射ID": "MAP-G08-010",
    "资产ID": "DANGER-041",
    "资产名称": "钟摆之城危险4",
    "应用场景": "SCN-G08-03",
    "UI": "UI-005/UI-012",
    "热点/入口": "HS-G08-0013",
    "关联危险/机制": "关联机制",
    "说明": "预警、安全窗口与软重置"
  },
  {
    "映射ID": "MAP-G08-011",
    "资产ID": "DANGER-042",
    "资产名称": "钟摆之城危险5",
    "应用场景": "SCN-G08-04",
    "UI": "UI-005/UI-012",
    "热点/入口": "HS-G08-0017",
    "关联危险/机制": "关联机制",
    "说明": "预警、安全窗口与软重置"
  },
  {
    "映射ID": "MAP-G08-012",
    "资产ID": "DANGER-043",
    "资产名称": "钟摆之城危险6",
    "应用场景": "SCN-G08-05",
    "UI": "UI-005/UI-012",
    "热点/入口": "HS-G08-0021",
    "关联危险/机制": "关联机制",
    "说明": "预警、安全窗口与软重置"
  }
]