[
  {
    "映射ID": "MAP-G05-001",
    "资产ID": "MECH-012",
    "资产名称": "双高度校准",
    "应用场景": "SCN-G05-00/01",
    "UI": "UI-024",
    "热点/入口": "HS-G05-0001—0007",
    "关联危险/机制": "DANGER-020/021",
    "说明": "镜像读数与动态标准"
  },
  {
    "映射ID": "MAP-G05-002",
    "资产ID": "MECH-013",
    "资产名称": "量杯上涨",
    "应用场景": "SCN-G05-02",
    "UI": "UI-025",
    "热点/入口": "HS-G05-0008—0011",
    "关联危险/机制": "DANGER-022",
    "说明": "容量分配与最低保障"
  },
  {
    "映射ID": "MAP-G05-003",
    "资产ID": "MECH-014",
    "资产名称": "误差带测量",
    "应用场景": "SCN-G05-03/05",
    "UI": "UI-026",
    "热点/入口": "HS-G05-0012—0015/0023—0024",
    "关联危险/机制": "DANGER-023/025",
    "说明": "多次测量与误差范围"
  },
  {
    "映射ID": "MAP-G05-004",
    "资产ID": "MECH-015",
    "资产名称": "薄冰安全路线",
    "应用场景": "SCN-G05-04",
    "UI": "UI-027",
    "热点/入口": "HS-G05-0016—0019",
    "关联危险/机制": "DANGER-024",
    "说明": "厚度、压力与步距"
  },
  {
    "映射ID": "MAP-G05-005",
    "资产ID": "UI-066",
    "资产名称": "管理员权限解除",
    "应用场景": "SCN-G05-06",
    "UI": "UI-066",
    "热点/入口": "HS-G05-0025—0029",
    "关联危险/机制": "MECH-012—015",
    "说明": "替代旧Boss战"
  },
  {
    "映射ID": "MAP-G05-006",
    "资产ID": "UI-067",
    "资产名称": "世界改变/学习结算",
    "应用场景": "SCN-G05-07/08",
    "UI": "UI-067",
    "热点/入口": "HS-G05-0030—0035",
    "关联危险/机制": "无",
    "说明": "章节结算"
  },
  {
    "映射ID": "MAP-G05-007",
    "资产ID": "DANGER-020",
    "资产名称": "镜像高度误判",
    "应用场景": "SCN-G05-00/06",
    "UI": "UI-024/UI-066",
    "热点/入口": "双高度显示/权限节点",
    "关联危险/机制": "MECH-012",
    "说明": "假读数与降落风险"
  },
  {
    "映射ID": "MAP-G05-008",
    "资产ID": "DANGER-021",
    "资产名称": "动态刻度漂移",
    "应用场景": "SCN-G05-01",
    "UI": "UI-024/UI-026",
    "热点/入口": "尺林刻度",
    "关联危险/机制": "MECH-012/014",
    "说明": "温度导致标准变化"
  },
  {
    "映射ID": "MAP-G05-009",
    "资产ID": "DANGER-022",
    "资产名称": "量杯站溢流",
    "应用场景": "SCN-G05-02/06",
    "UI": "UI-025/UI-012",
    "热点/入口": "水位计/供水节点",
    "关联危险/机制": "MECH-013",
    "说明": "水位上涨与最低保障"
  },
  {
    "映射ID": "MAP-G05-010",
    "资产ID": "DANGER-023",
    "资产名称": "冰桥桥头错位",
    "应用场景": "SCN-G05-03",
    "UI": "UI-026/UI-012",
    "热点/入口": "桥板铺设/错位裂缝",
    "关联危险/机制": "MECH-014",
    "说明": "剧情性失败"
  },
  {
    "映射ID": "MAP-G05-011",
    "资产ID": "DANGER-024",
    "资产名称": "薄冰承压破裂",
    "应用场景": "SCN-G05-04",
    "UI": "UI-027/UI-012",
    "热点/入口": "厚度点/路线节点",
    "关联危险/机制": "MECH-015",
    "说明": "安全节点撤离"
  },
  {
    "映射ID": "MAP-G05-012",
    "资产ID": "DANGER-025",
    "资产名称": "风暴桥轨收缩",
    "应用场景": "SCN-G05-05/06",
    "UI": "UI-026/UI-027",
    "热点/入口": "滑轨桥/风切控制器",
    "关联危险/机制": "MECH-014/015",
    "说明": "伸缩余量与复测"
  }
]
