[
  {
    "映射ID": "MAP-G10-001",
    "资产ID": "MECH-032",
    "资产名称": "风向样本墙",
    "应用场景": "SCN-G10-00/SCN-G10-01",
    "UI": "UI-044",
    "热点/入口": "HS-G10-0001—0008",
    "关联危险/机制": "DANGER-050",
    "说明": "机制与场景状态对应"
  },
  {
    "映射ID": "MAP-G10-002",
    "资产ID": "MECH-033",
    "资产名称": "货箱抽样调查",
    "应用场景": "SCN-G10-02/SCN-G10-03",
    "UI": "UI-045",
    "热点/入口": "HS-G10-0009—0016",
    "关联危险/机制": "DANGER-051",
    "说明": "机制与场景状态对应"
  },
  {
    "映射ID": "MAP-G10-003",
    "资产ID": "MECH-034",
    "资产名称": "概率门阵",
    "应用场景": "SCN-G10-04/SCN-G10-05",
    "UI": "UI-046",
    "热点/入口": "HS-G10-0017—0024",
    "关联危险/机制": "DANGER-052",
    "说明": "机制与场景状态对应"
  },
  {
    "映射ID": "MAP-G10-004",
    "资产ID": "MECH-035",
    "资产名称": "天气决策板",
    "应用场景": "SCN-G10-06/SCN-G10-07",
    "UI": "UI-047",
    "热点/入口": "HS-G10-0025—0032",
    "关联危险/机制": "DANGER-053",
    "说明": "机制与场景状态对应"
  },
  {
    "映射ID": "MAP-G10-005",
    "资产ID": "UI-076",
    "资产名称": "管理员对话/权限解除",
    "应用场景": "SCN-G10-07",
    "UI": "UI-076",
    "热点/入口": "HS-G10-0029—0032",
    "关联危险/机制": "DANGER-053/DANGER-054/DANGER-055",
    "说明": "替代旧Boss战"
  },
  {
    "映射ID": "MAP-G10-006",
    "资产ID": "UI-077",
    "资产名称": "世界改变/学习结算",
    "应用场景": "SCN-G10-08/SCN-G10-09",
    "UI": "UI-077",
    "热点/入口": "HS-G10-0033—0040",
    "关联危险/机制": "无",
    "说明": "章节结算"
  },
  {
    "映射ID": "MAP-G10-007",
    "资产ID": "DANGER-050",
    "资产名称": "概率云港危险1",
    "应用场景": "SCN-G10-00",
    "UI": "UI-005/UI-012",
    "热点/入口": "HS-G10-0001",
    "关联危险/机制": "关联机制",
    "说明": "预警、安全窗口与软重置"
  },
  {
    "映射ID": "MAP-G10-008",
    "资产ID": "DANGER-051",
    "资产名称": "概率云港危险2",
    "应用场景": "SCN-G10-01",
    "UI": "UI-005/UI-012",
    "热点/入口": "HS-G10-0005",
    "关联危险/机制": "关联机制",
    "说明": "预警、安全窗口与软重置"
  },
  {
    "映射ID": "MAP-G10-009",
    "资产ID": "DANGER-052",
    "资产名称": "概率云港危险3",
    "应用场景": "SCN-G10-02",
    "UI": "UI-005/UI-012",
    "热点/入口": "HS-G10-0009",
    "关联危险/机制": "关联机制",
    "说明": "预警、安全窗口与软重置"
  },
  {
    "映射ID": "MAP-G10-010",
    "资产ID": "DANGER-053",
    "资产名称": "概率云港危险4",
    "应用场景": "SCN-G10-03",
    "UI": "UI-005/UI-012",
    "热点/入口": "HS-G10-0013",
    "关联危险/机制": "关联机制",
    "说明": "预警、安全窗口与软重置"
  },
  {
    "映射ID": "MAP-G10-011",
    "资产ID": "DANGER-054",
    "资产名称": "概率云港危险5",
    "应用场景": "SCN-G10-04",
    "UI": "UI-005/UI-012",
    "热点/入口": "HS-G10-0017",
    "关联危险/机制": "关联机制",
    "说明": "预警、安全窗口与软重置"
  },
  {
    "映射ID": "MAP-G10-012",
    "资产ID": "DANGER-055",
    "资产名称": "概率云港危险6",
    "应用场景": "SCN-G10-05",
    "UI": "UI-005/UI-012",
    "热点/入口": "HS-G10-0021",
    "关联危险/机制": "关联机制",
    "说明": "预警、安全窗口与软重置"
  }
]