[
  {
    "映射ID": "MAP-G03-001",
    "资产ID": "MECH-004",
    "资产名称": "真实需求表",
    "应用场景": "SCN-G03-01/02",
    "UI": "UI-016",
    "热点/入口": "HS-G03-0008/0009",
    "关联危险/机制": "DANGER-008",
    "说明": "需求归并与优先级"
  },
  {
    "映射ID": "MAP-G03-002",
    "资产ID": "MECH-005",
    "资产名称": "订单欺骗",
    "应用场景": "SCN-G03-03/04",
    "UI": "UI-017",
    "热点/入口": "HS-G03-0015/0020",
    "关联危险/机制": "DANGER-010/011",
    "说明": "订单取证与干扰订单"
  },
  {
    "映射ID": "MAP-G03-003",
    "资产ID": "MECH-006",
    "资产名称": "传送带逆行",
    "应用场景": "SCN-G03-05/06",
    "UI": "UI-018",
    "热点/入口": "HS-G03-0022—0030",
    "关联危险/机制": "DANGER-012/013",
    "说明": "方向、速度与分流"
  },
  {
    "映射ID": "MAP-G03-004",
    "资产ID": "MECH-007",
    "资产名称": "公开分配会",
    "应用场景": "SCN-G03-08",
    "UI": "UI-019",
    "热点/入口": "HS-G03-0036—0039",
    "关联危险/机制": "DANGER-008",
    "说明": "最低保障与储备"
  },
  {
    "映射ID": "MAP-G03-005",
    "资产ID": "UI-062",
    "资产名称": "管理员权限解除",
    "应用场景": "SCN-G03-07",
    "UI": "UI-062",
    "热点/入口": "HS-G03-0031—0035",
    "关联危险/机制": "MECH-004—007",
    "说明": "替代旧Boss战"
  },
  {
    "映射ID": "MAP-G03-006",
    "资产ID": "UI-063",
    "资产名称": "世界改变/学习结算",
    "应用场景": "SCN-G03-09",
    "UI": "UI-063",
    "热点/入口": "HS-G03-0040—0042",
    "关联危险/机制": "无",
    "说明": "章节结算"
  },
  {
    "映射ID": "MAP-G03-007",
    "资产ID": "DANGER-007",
    "资产名称": "码头传送带逆行",
    "应用场景": "SCN-G03-00",
    "UI": "UI-005/UI-012",
    "热点/入口": "HS-G03-0001/0002",
    "关联危险/机制": "MECH-006",
    "说明": "入场救援"
  },
  {
    "映射ID": "MAP-G03-008",
    "资产ID": "DANGER-008",
    "资产名称": "仓库争抢拥堵",
    "应用场景": "SCN-G03-01/08",
    "UI": "UI-016/UI-019",
    "热点/入口": "仓库门前/分配桌",
    "关联危险/机制": "MECH-004/007",
    "说明": "资源冲突"
  },
  {
    "映射ID": "MAP-G03-009",
    "资产ID": "DANGER-009",
    "资产名称": "缺口盘传送误判",
    "应用场景": "SCN-G03-02",
    "UI": "UI-016",
    "热点/入口": "HS-G03-0009",
    "关联危险/机制": "MECH-004",
    "说明": "错误需求判定"
  },
  {
    "映射ID": "MAP-G03-010",
    "资产ID": "DANGER-010",
    "资产名称": "腹仓货箱错投",
    "应用场景": "SCN-G03-03",
    "UI": "UI-017",
    "热点/入口": "HS-G03-0012—0016",
    "关联危险/机制": "MECH-005",
    "说明": "标签错位"
  },
  {
    "映射ID": "MAP-G03-011",
    "资产ID": "DANGER-011",
    "资产名称": "印刷台字段覆盖",
    "应用场景": "SCN-G03-04",
    "UI": "UI-017",
    "热点/入口": "HS-G03-0017—0020",
    "关联危险/机制": "MECH-005",
    "说明": "订单覆盖风险"
  },
  {
    "映射ID": "MAP-G03-012",
    "资产ID": "DANGER-012",
    "资产名称": "腹仓逐层闭合",
    "应用场景": "SCN-G03-05",
    "UI": "UI-005/UI-012",
    "热点/入口": "HS-G03-0021—0025",
    "关联危险/机制": "MECH-006",
    "说明": "安全节点撤离"
  },
  {
    "映射ID": "MAP-G03-013",
    "资产ID": "DANGER-013",
    "资产名称": "传送带带速失控",
    "应用场景": "SCN-G03-06",
    "UI": "UI-018/UI-012",
    "热点/入口": "HS-G03-0026—0030",
    "关联危险/机制": "MECH-006",
    "说明": "过速保护"
  }
]