[
  {
    "映射ID": "MAP-G13-001",
    "资产ID": "MECH-044",
    "资产名称": "十二星数据闭环",
    "应用场景": "SCN-G13-00/SCN-G13-01",
    "UI": "UI-056",
    "热点/入口": "HS-G13-0001—0008",
    "关联危险/机制": "DANGER-068",
    "说明": "机制与场景状态对应"
  },
  {
    "映射ID": "MAP-G13-002",
    "资产ID": "MECH-045",
    "资产名称": "文明样本唤醒",
    "应用场景": "SCN-G13-02/SCN-G13-03",
    "UI": "UI-057",
    "热点/入口": "HS-G13-0009—0016",
    "关联危险/机制": "DANGER-069",
    "说明": "机制与场景状态对应"
  },
  {
    "映射ID": "MAP-G13-003",
    "资产ID": "MECH-046",
    "资产名称": "历史真相拼合",
    "应用场景": "SCN-G13-04/SCN-G13-05",
    "UI": "UI-058",
    "热点/入口": "HS-G13-0017—0024",
    "关联危险/机制": "DANGER-070",
    "说明": "机制与场景状态对应"
  },
  {
    "映射ID": "MAP-G13-004",
    "资产ID": "MECH-047",
    "资产名称": "最终手动维修",
    "应用场景": "SCN-G13-06/SCN-G13-07",
    "UI": "UI-059",
    "热点/入口": "HS-G13-0025—0032",
    "关联危险/机制": "DANGER-071",
    "说明": "机制与场景状态对应"
  },
  {
    "映射ID": "MAP-G13-005",
    "资产ID": "UI-082",
    "资产名称": "管理员对话/权限解除",
    "应用场景": "SCN-G13-07",
    "UI": "UI-082",
    "热点/入口": "HS-G13-0029—0032",
    "关联危险/机制": "DANGER-074/DANGER-075/DANGER-076",
    "说明": "替代旧Boss战"
  },
  {
    "映射ID": "MAP-G13-006",
    "资产ID": "UI-083",
    "资产名称": "世界改变/学习结算",
    "应用场景": "SCN-G13-08/SCN-G13-09",
    "UI": "UI-083",
    "热点/入口": "HS-G13-0033—0040",
    "关联危险/机制": "无",
    "说明": "章节结算"
  },
  {
    "映射ID": "MAP-G13-007",
    "资产ID": "DANGER-068",
    "资产名称": "零号地球危险1",
    "应用场景": "SCN-G13-00",
    "UI": "UI-005/UI-012",
    "热点/入口": "HS-G13-0001",
    "关联危险/机制": "关联机制",
    "说明": "预警、安全窗口与软重置"
  },
  {
    "映射ID": "MAP-G13-008",
    "资产ID": "DANGER-069",
    "资产名称": "零号地球危险2",
    "应用场景": "SCN-G13-01",
    "UI": "UI-005/UI-012",
    "热点/入口": "HS-G13-0005",
    "关联危险/机制": "关联机制",
    "说明": "预警、安全窗口与软重置"
  },
  {
    "映射ID": "MAP-G13-009",
    "资产ID": "DANGER-070",
    "资产名称": "零号地球危险3",
    "应用场景": "SCN-G13-02",
    "UI": "UI-005/UI-012",
    "热点/入口": "HS-G13-0009",
    "关联危险/机制": "关联机制",
    "说明": "预警、安全窗口与软重置"
  },
  {
    "映射ID": "MAP-G13-010",
    "资产ID": "DANGER-071",
    "资产名称": "零号地球危险4",
    "应用场景": "SCN-G13-03",
    "UI": "UI-005/UI-012",
    "热点/入口": "HS-G13-0013",
    "关联危险/机制": "关联机制",
    "说明": "预警、安全窗口与软重置"
  },
  {
    "映射ID": "MAP-G13-011",
    "资产ID": "DANGER-072",
    "资产名称": "零号地球危险5",
    "应用场景": "SCN-G13-04",
    "UI": "UI-005/UI-012",
    "热点/入口": "HS-G13-0017",
    "关联危险/机制": "关联机制",
    "说明": "预警、安全窗口与软重置"
  },
  {
    "映射ID": "MAP-G13-012",
    "资产ID": "DANGER-073",
    "资产名称": "零号地球危险6",
    "应用场景": "SCN-G13-05",
    "UI": "UI-005/UI-012",
    "热点/入口": "HS-G13-0021",
    "关联危险/机制": "关联机制",
    "说明": "预警、安全窗口与软重置"
  },
  {
    "映射ID": "MAP-G13-013",
    "资产ID": "DANGER-074",
    "资产名称": "零号地球危险7",
    "应用场景": "SCN-G13-06",
    "UI": "UI-005/UI-012",
    "热点/入口": "HS-G13-0025",
    "关联危险/机制": "关联机制",
    "说明": "预警、安全窗口与软重置"
  },
  {
    "映射ID": "MAP-G13-014",
    "资产ID": "DANGER-075",
    "资产名称": "零号地球危险8",
    "应用场景": "SCN-G13-07",
    "UI": "UI-005/UI-012",
    "热点/入口": "HS-G13-0029",
    "关联危险/机制": "关联机制",
    "说明": "预警、安全窗口与软重置"
  },
  {
    "映射ID": "MAP-G13-015",
    "资产ID": "DANGER-076",
    "资产名称": "零号地球危险9",
    "应用场景": "SCN-G13-08",
    "UI": "UI-005/UI-012",
    "热点/入口": "HS-G13-0033",
    "关联危险/机制": "关联机制",
    "说明": "预警、安全窗口与软重置"
  }
]