[
  {
    "映射ID": "MAP-G06-001",
    "资产ID": "MECH-016",
    "资产名称": "九片航线重组",
    "应用场景": "SCN-G06-00/SCN-G06-01",
    "UI": "UI-028",
    "热点/入口": "HS-G06-0001—0008",
    "关联危险/机制": "DANGER-026",
    "说明": "机制与场景状态对应"
  },
  {
    "映射ID": "MAP-G06-002",
    "资产ID": "MECH-017",
    "资产名称": "缺口表归并",
    "应用场景": "SCN-G06-02/SCN-G06-03",
    "UI": "UI-029",
    "热点/入口": "HS-G06-0009—0016",
    "关联危险/机制": "DANGER-027",
    "说明": "机制与场景状态对应"
  },
  {
    "映射ID": "MAP-G06-003",
    "资产ID": "MECH-018",
    "资产名称": "比例桥材切分",
    "应用场景": "SCN-G06-04/SCN-G06-05",
    "UI": "UI-030",
    "热点/入口": "HS-G06-0017—0024",
    "关联危险/机制": "DANGER-028",
    "说明": "机制与场景状态对应"
  },
  {
    "映射ID": "MAP-G06-004",
    "资产ID": "MECH-019",
    "资产名称": "岛链能源配比",
    "应用场景": "SCN-G06-06/SCN-G06-07",
    "UI": "UI-031",
    "热点/入口": "HS-G06-0025—0032",
    "关联危险/机制": "DANGER-029",
    "说明": "机制与场景状态对应"
  },
  {
    "映射ID": "MAP-G06-005",
    "资产ID": "UI-068",
    "资产名称": "管理员对话/权限解除",
    "应用场景": "SCN-G06-07",
    "UI": "UI-068",
    "热点/入口": "HS-G06-0029—0032",
    "关联危险/机制": "DANGER-029/DANGER-030/DANGER-031",
    "说明": "替代旧Boss战"
  },
  {
    "映射ID": "MAP-G06-006",
    "资产ID": "UI-069",
    "资产名称": "世界改变/学习结算",
    "应用场景": "SCN-G06-08/SCN-G06-09",
    "UI": "UI-069",
    "热点/入口": "HS-G06-0033—0040",
    "关联危险/机制": "无",
    "说明": "章节结算"
  },
  {
    "映射ID": "MAP-G06-007",
    "资产ID": "DANGER-026",
    "资产名称": "分片群岛危险1",
    "应用场景": "SCN-G06-00",
    "UI": "UI-005/UI-012",
    "热点/入口": "HS-G06-0001",
    "关联危险/机制": "关联机制",
    "说明": "预警、安全窗口与软重置"
  },
  {
    "映射ID": "MAP-G06-008",
    "资产ID": "DANGER-027",
    "资产名称": "分片群岛危险2",
    "应用场景": "SCN-G06-01",
    "UI": "UI-005/UI-012",
    "热点/入口": "HS-G06-0005",
    "关联危险/机制": "关联机制",
    "说明": "预警、安全窗口与软重置"
  },
  {
    "映射ID": "MAP-G06-009",
    "资产ID": "DANGER-028",
    "资产名称": "分片群岛危险3",
    "应用场景": "SCN-G06-02",
    "UI": "UI-005/UI-012",
    "热点/入口": "HS-G06-0009",
    "关联危险/机制": "关联机制",
    "说明": "预警、安全窗口与软重置"
  },
  {
    "映射ID": "MAP-G06-010",
    "资产ID": "DANGER-029",
    "资产名称": "分片群岛危险4",
    "应用场景": "SCN-G06-03",
    "UI": "UI-005/UI-012",
    "热点/入口": "HS-G06-0013",
    "关联危险/机制": "关联机制",
    "说明": "预警、安全窗口与软重置"
  },
  {
    "映射ID": "MAP-G06-011",
    "资产ID": "DANGER-030",
    "资产名称": "分片群岛危险5",
    "应用场景": "SCN-G06-04",
    "UI": "UI-005/UI-012",
    "热点/入口": "HS-G06-0017",
    "关联危险/机制": "关联机制",
    "说明": "预警、安全窗口与软重置"
  },
  {
    "映射ID": "MAP-G06-012",
    "资产ID": "DANGER-031",
    "资产名称": "分片群岛危险6",
    "应用场景": "SCN-G06-05",
    "UI": "UI-005/UI-012",
    "热点/入口": "HS-G06-0021",
    "关联危险/机制": "关联机制",
    "说明": "预警、安全窗口与软重置"
  }
]