[
  {
    "映射ID": "MAP-G07-001",
    "资产ID": "MECH-020",
    "资产名称": "城门平移一格",
    "应用场景": "SCN-G07-00/SCN-G07-01",
    "UI": "UI-032",
    "热点/入口": "HS-G07-0001—0008",
    "关联危险/机制": "DANGER-032",
    "说明": "机制与场景状态对应"
  },
  {
    "映射ID": "MAP-G07-002",
    "资产ID": "MECH-021",
    "资产名称": "最后一块空地",
    "应用场景": "SCN-G07-02/SCN-G07-03",
    "UI": "UI-033",
    "热点/入口": "HS-G07-0009—0016",
    "关联危险/机制": "DANGER-033",
    "说明": "机制与场景状态对应"
  },
  {
    "映射ID": "MAP-G07-003",
    "资产ID": "MECH-022",
    "资产名称": "周长封锁线",
    "应用场景": "SCN-G07-04/SCN-G07-05",
    "UI": "UI-034",
    "热点/入口": "HS-G07-0017—0024",
    "关联危险/机制": "DANGER-034",
    "说明": "机制与场景状态对应"
  },
  {
    "映射ID": "MAP-G07-004",
    "资产ID": "MECH-023",
    "资产名称": "三角支撑网",
    "应用场景": "SCN-G07-06/SCN-G07-07",
    "UI": "UI-035",
    "热点/入口": "HS-G07-0025—0032",
    "关联危险/机制": "DANGER-035",
    "说明": "机制与场景状态对应"
  },
  {
    "映射ID": "MAP-G07-005",
    "资产ID": "UI-070",
    "资产名称": "管理员对话/权限解除",
    "应用场景": "SCN-G07-07",
    "UI": "UI-070",
    "热点/入口": "HS-G07-0029—0032",
    "关联危险/机制": "DANGER-035/DANGER-036/DANGER-037",
    "说明": "替代旧Boss战"
  },
  {
    "映射ID": "MAP-G07-006",
    "资产ID": "UI-071",
    "资产名称": "世界改变/学习结算",
    "应用场景": "SCN-G07-08/SCN-G07-09",
    "UI": "UI-071",
    "热点/入口": "HS-G07-0033—0040",
    "关联危险/机制": "无",
    "说明": "章节结算"
  },
  {
    "映射ID": "MAP-G07-007",
    "资产ID": "DANGER-032",
    "资产名称": "方格城危险1",
    "应用场景": "SCN-G07-00",
    "UI": "UI-005/UI-012",
    "热点/入口": "HS-G07-0001",
    "关联危险/机制": "关联机制",
    "说明": "预警、安全窗口与软重置"
  },
  {
    "映射ID": "MAP-G07-008",
    "资产ID": "DANGER-033",
    "资产名称": "方格城危险2",
    "应用场景": "SCN-G07-01",
    "UI": "UI-005/UI-012",
    "热点/入口": "HS-G07-0005",
    "关联危险/机制": "关联机制",
    "说明": "预警、安全窗口与软重置"
  },
  {
    "映射ID": "MAP-G07-009",
    "资产ID": "DANGER-034",
    "资产名称": "方格城危险3",
    "应用场景": "SCN-G07-02",
    "UI": "UI-005/UI-012",
    "热点/入口": "HS-G07-0009",
    "关联危险/机制": "关联机制",
    "说明": "预警、安全窗口与软重置"
  },
  {
    "映射ID": "MAP-G07-010",
    "资产ID": "DANGER-035",
    "资产名称": "方格城危险4",
    "应用场景": "SCN-G07-03",
    "UI": "UI-005/UI-012",
    "热点/入口": "HS-G07-0013",
    "关联危险/机制": "关联机制",
    "说明": "预警、安全窗口与软重置"
  },
  {
    "映射ID": "MAP-G07-011",
    "资产ID": "DANGER-036",
    "资产名称": "方格城危险5",
    "应用场景": "SCN-G07-04",
    "UI": "UI-005/UI-012",
    "热点/入口": "HS-G07-0017",
    "关联危险/机制": "关联机制",
    "说明": "预警、安全窗口与软重置"
  },
  {
    "映射ID": "MAP-G07-012",
    "资产ID": "DANGER-037",
    "资产名称": "方格城危险6",
    "应用场景": "SCN-G07-05",
    "UI": "UI-005/UI-012",
    "热点/入口": "HS-G07-0021",
    "关联危险/机制": "关联机制",
    "说明": "预警、安全窗口与软重置"
  }
]