[
  {
    "映射ID": "MAP-G04-001",
    "资产ID": "MECH-008",
    "资产名称": "现实/镜像双层坐标",
    "应用场景": "SCN-G04-00/01",
    "UI": "UI-020",
    "热点/入口": "HS-G04-0001—0006",
    "关联危险/机制": "DANGER-014/015",
    "说明": "坐标转换与真实方向"
  },
  {
    "映射ID": "MAP-G04-002",
    "资产ID": "MECH-009",
    "资产名称": "记忆耐久",
    "应用场景": "SCN-G04-02/05",
    "UI": "UI-021",
    "热点/入口": "HS-G04-0007—0010/0019—0023",
    "关联危险/机制": "DANGER-016/019",
    "说明": "来源验证与记忆固定"
  },
  {
    "映射ID": "MAP-G04-003",
    "资产ID": "MECH-010",
    "资产名称": "反向输入机关",
    "应用场景": "SCN-G04-03",
    "UI": "UI-022",
    "热点/入口": "HS-G04-0011—0013",
    "关联危险/机制": "DANGER-017",
    "说明": "单步测试与规则识别"
  },
  {
    "映射ID": "MAP-G04-004",
    "资产ID": "MECH-011",
    "资产名称": "欺骗预测",
    "应用场景": "SCN-G04-04/06",
    "UI": "UI-023",
    "热点/入口": "HS-G04-0014—0018/0024—0026",
    "关联危险/机制": "DANGER-018",
    "说明": "诱饵规律和真实入口"
  },
  {
    "映射ID": "MAP-G04-005",
    "资产ID": "UI-064",
    "资产名称": "管理员权限解除",
    "应用场景": "SCN-G04-07",
    "UI": "UI-064",
    "热点/入口": "HS-G04-0027—0031",
    "关联危险/机制": "MECH-008—011",
    "说明": "替代旧Boss战"
  },
  {
    "映射ID": "MAP-G04-006",
    "资产ID": "UI-065",
    "资产名称": "世界改变/学习结算",
    "应用场景": "SCN-G04-08/09",
    "UI": "UI-065",
    "热点/入口": "HS-G04-0032—0036",
    "关联危险/机制": "无",
    "说明": "章节结算"
  },
  {
    "映射ID": "MAP-G04-007",
    "资产ID": "DANGER-014",
    "资产名称": "镜像导航错位",
    "应用场景": "SCN-G04-00",
    "UI": "UI-005/UI-020",
    "热点/入口": "HS-G04-0001/0002",
    "关联危险/机制": "MECH-008",
    "说明": "落点误判"
  },
  {
    "映射ID": "MAP-G04-008",
    "资产ID": "DANGER-015",
    "资产名称": "路标层级混淆",
    "应用场景": "SCN-G04-01/07",
    "UI": "UI-020/UI-064",
    "热点/入口": "HS-G04-0003—0006/0027",
    "关联危险/机制": "MECH-008",
    "说明": "现实镜像错位"
  },
  {
    "映射ID": "MAP-G04-009",
    "资产ID": "DANGER-016",
    "资产名称": "记忆碎片褪色",
    "应用场景": "SCN-G04-02",
    "UI": "UI-021/UI-012",
    "热点/入口": "HS-G04-0007—0010",
    "关联危险/机制": "MECH-009",
    "说明": "耐久下降与安全固定"
  },
  {
    "映射ID": "MAP-G04-010",
    "资产ID": "DANGER-017",
    "资产名称": "反向门阵误触",
    "应用场景": "SCN-G04-03/07",
    "UI": "UI-022/UI-012",
    "热点/入口": "HS-G04-0011—0013/0029",
    "关联危险/机制": "MECH-010",
    "说明": "错误输入软重置"
  },
  {
    "映射ID": "MAP-G04-011",
    "资产ID": "DANGER-018",
    "资产名称": "镜片风暴与诱饵",
    "应用场景": "SCN-G04-04/06",
    "UI": "UI-023/UI-012",
    "热点/入口": "HS-G04-0014—0018/0024—0026",
    "关联危险/机制": "MECH-011",
    "说明": "视野干扰与预测"
  },
  {
    "映射ID": "MAP-G04-012",
    "资产ID": "DANGER-019",
    "资产名称": "档案来源错拼",
    "应用场景": "SCN-G04-05/07",
    "UI": "UI-010/UI-021",
    "热点/入口": "HS-G04-0019—0023/0028",
    "关联危险/机制": "MECH-009",
    "说明": "矛盾记录与覆盖风险"
  }
]
