[
  {
    "映射ID": "MAP-G01-001",
    "资产ID": "TUT-MECH-001",
    "资产名称": "基础维修顺序",
    "应用场景": "SCN-G01-00/01",
    "UI": "UI-007/UI-011",
    "热点/入口": "HS-G01-0003—0008",
    "关联危险/机制": "DANGER-G01-001",
    "说明": "拾取、背包、组合和顺序反馈"
  },
  {
    "映射ID": "MAP-G01-002",
    "资产ID": "TUT-MECH-002",
    "资产名称": "星图校准",
    "应用场景": "SCN-G01-04",
    "UI": "UI-010/UI-011",
    "热点/入口": "HS-G01-0017—0020",
    "关联危险/机制": "DANGER-G01-003",
    "说明": "找物、拼图、证据分析"
  },
  {
    "映射ID": "MAP-G01-003",
    "资产ID": "TUT-MECH-003",
    "资产名称": "垃圾雨航线",
    "应用场景": "SCN-G01-05",
    "UI": "UI-009/UI-005",
    "热点/入口": "HS-G01-0021—0024",
    "关联危险/机制": "DANGER-G01-004",
    "说明": "安全节点与时间窗口"
  },
  {
    "映射ID": "MAP-G01-004",
    "资产ID": "DANGER-G01-001",
    "资产名称": "船舱断电与短路",
    "应用场景": "SCN-G01-00/01",
    "UI": "UI-005/UI-012",
    "热点/入口": "配电盒/七码供电槽",
    "关联危险/机制": "TUT-MECH-001",
    "说明": "预警与错误顺序软重置"
  },
  {
    "映射ID": "MAP-G01-005",
    "资产ID": "DANGER-G01-002",
    "资产名称": "货舱氧压下降",
    "应用场景": "SCN-G01-03",
    "UI": "UI-005/UI-012",
    "热点/入口": "裂口/压力表/复压阀",
    "关联危险/机制": "无",
    "说明": "安全倒计时和舱门回退"
  },
  {
    "映射ID": "MAP-G01-006",
    "资产ID": "DANGER-G01-003",
    "资产名称": "星图数据闪断",
    "应用场景": "SCN-G01-04",
    "UI": "UI-010",
    "热点/入口": "星图碎片/异常信号层",
    "关联危险/机制": "TUT-MECH-002",
    "说明": "错误碎片不覆盖正确记录"
  },
  {
    "映射ID": "MAP-G01-007",
    "资产ID": "DANGER-G01-004",
    "资产名称": "垃圾雨撞击窗口",
    "应用场景": "SCN-G01-05/07",
    "UI": "UI-005/UI-012",
    "热点/入口": "航线节点/落点扫描",
    "关联危险/机制": "TUT-MECH-003",
    "说明": "安全节点与时间窗口"
  },
  {
    "映射ID": "MAP-G01-008",
    "资产ID": "UI-001—012",
    "资产名称": "全局UI复用",
    "应用场景": "G01全章",
    "UI": "UI-001—012",
    "热点/入口": "菜单/HUD/背包/任务/地图/档案/恢复",
    "关联危险/机制": "无",
    "说明": "不新增UI编号"
  }
]