[
  {
    "映射ID": "MAP-G12-001",
    "资产ID": "MECH-040",
    "资产名称": "多工序依赖网",
    "应用场景": "SCN-G12-00/SCN-G12-01",
    "UI": "UI-052",
    "热点/入口": "HS-G12-0001—0008",
    "关联危险/机制": "DANGER-062",
    "说明": "机制与场景状态对应"
  },
  {
    "映射ID": "MAP-G12-002",
    "资产ID": "MECH-041",
    "资产名称": "跨接口接驳",
    "应用场景": "SCN-G12-02/SCN-G12-03",
    "UI": "UI-053",
    "热点/入口": "HS-G12-0009—0016",
    "关联危险/机制": "DANGER-063",
    "说明": "机制与场景状态对应"
  },
  {
    "映射ID": "MAP-G12-003",
    "资产ID": "MECH-042",
    "资产名称": "风暴姿态稳定",
    "应用场景": "SCN-G12-04/SCN-G12-05",
    "UI": "UI-054",
    "热点/入口": "HS-G12-0017—0024",
    "关联危险/机制": "DANGER-064",
    "说明": "机制与场景状态对应"
  },
  {
    "映射ID": "MAP-G12-004",
    "资产ID": "MECH-043",
    "资产名称": "质量复核闭环",
    "应用场景": "SCN-G12-06/SCN-G12-07",
    "UI": "UI-055",
    "热点/入口": "HS-G12-0025—0032",
    "关联危险/机制": "DANGER-065",
    "说明": "机制与场景状态对应"
  },
  {
    "映射ID": "MAP-G12-005",
    "资产ID": "UI-080",
    "资产名称": "管理员对话/权限解除",
    "应用场景": "SCN-G12-07",
    "UI": "UI-080",
    "热点/入口": "HS-G12-0029—0032",
    "关联危险/机制": "DANGER-065/DANGER-066/DANGER-067",
    "说明": "替代旧Boss战"
  },
  {
    "映射ID": "MAP-G12-006",
    "资产ID": "UI-081",
    "资产名称": "世界改变/学习结算",
    "应用场景": "SCN-G12-08/SCN-G12-09",
    "UI": "UI-081",
    "热点/入口": "HS-G12-0033—0040",
    "关联危险/机制": "无",
    "说明": "章节结算"
  },
  {
    "映射ID": "MAP-G12-007",
    "资产ID": "DANGER-062",
    "资产名称": "百工星环危险1",
    "应用场景": "SCN-G12-00",
    "UI": "UI-005/UI-012",
    "热点/入口": "HS-G12-0001",
    "关联危险/机制": "关联机制",
    "说明": "预警、安全窗口与软重置"
  },
  {
    "映射ID": "MAP-G12-008",
    "资产ID": "DANGER-063",
    "资产名称": "百工星环危险2",
    "应用场景": "SCN-G12-01",
    "UI": "UI-005/UI-012",
    "热点/入口": "HS-G12-0005",
    "关联危险/机制": "关联机制",
    "说明": "预警、安全窗口与软重置"
  },
  {
    "映射ID": "MAP-G12-009",
    "资产ID": "DANGER-064",
    "资产名称": "百工星环危险3",
    "应用场景": "SCN-G12-02",
    "UI": "UI-005/UI-012",
    "热点/入口": "HS-G12-0009",
    "关联危险/机制": "关联机制",
    "说明": "预警、安全窗口与软重置"
  },
  {
    "映射ID": "MAP-G12-010",
    "资产ID": "DANGER-065",
    "资产名称": "百工星环危险4",
    "应用场景": "SCN-G12-03",
    "UI": "UI-005/UI-012",
    "热点/入口": "HS-G12-0013",
    "关联危险/机制": "关联机制",
    "说明": "预警、安全窗口与软重置"
  },
  {
    "映射ID": "MAP-G12-011",
    "资产ID": "DANGER-066",
    "资产名称": "百工星环危险5",
    "应用场景": "SCN-G12-04",
    "UI": "UI-005/UI-012",
    "热点/入口": "HS-G12-0017",
    "关联危险/机制": "关联机制",
    "说明": "预警、安全窗口与软重置"
  },
  {
    "映射ID": "MAP-G12-012",
    "资产ID": "DANGER-067",
    "资产名称": "百工星环危险6",
    "应用场景": "SCN-G12-05",
    "UI": "UI-005/UI-012",
    "热点/入口": "HS-G12-0021",
    "关联危险/机制": "关联机制",
    "说明": "预警、安全窗口与软重置"
  }
]